topic,yoruba_title,english_title,yoruba_content,english_content,url
finance,Nítorí mo fẹ́ mọ̀ nípa èdè àti àṣà ni mo ṣe wá kọ́ èdè Yorùbá ní Nàìjíríà',"I want to know how to do the Yoruba language, in Nigeria'","Ọ̀kan lára àwọn ọ́nà tí ìjọba máa gbà láti mú àgbéga bá èdè, àṣà àti ìṣe ilẹ̀ rẹ̀ ni láti rí dájú pé àwọn èèyàn orílẹ̀ èdè rẹ̀ kọ́ nípa àṣà àti ìṣe wọn bí ó tilẹ̀ jẹ́ pé ilẹ̀ òkèèrè ni wọ́n ń gbé. Irú ìgbésẹ̀ báyìí ló máa ń wáyé láàárín ìjọba orílẹ̀ èdè kan sí òmíràn níbi tí àwọn ọmọ ilẹ̀ orílẹ̀ èdè náà máa ń wá sí Nàìjíríà láti wá kọ́ nípa èdè, àṣà àti ìṣe ilẹ̀ Nàìjíríà. Adele Olùdarí ní ẹ̀ka tí wọ́n ti ń kọ́ èdè Yorùbá ní ilé ẹ̀kọ́ gíga fásitì University of Ibadan, Clement Odoje sọ pé àwọn èèyàn tó lè ní ẹgbẹ̀rún méjì ló ti wá ń kọ́ nípa èdè àti àṣà ilẹ̀ Yorùbá láti ìgbà tí wọ́n ti dá ètò náà sílẹ̀. Odoje ní láti orílẹ̀ èdè káàkiri bíi Amẹ́ríkà, China, Japan, Brazil, Spain àti bẹ́ẹ̀ bẹ́ẹ̀ lọ ní àwọn èèyàn ti máa ń wá láti kọ́ nípa èdè Yorùbá. Ó fi kun pé àwọn ọmọ Nàìjíríà tí wọ́n dàgbà sílẹ̀ òkèèrè, tí wọ́n kò sì ní ìmọ̀ tó nípa àṣà àti ìṣe wọn náà máa ń wá sí iléeṣẹ́ náà láti wá kọ́ nípa èdè àti àṣà wọn. Ó ní àwọn ń kọ́ àwọn èèyàn ní èdè Yorùbá tí wọn yóò lè máa ṣàmúlò ní gbogbo ibikíbi tí àwọn akẹ́kọ̀ọ́ náà bá ti ba ara wọn ni àwọn ń kọ́ wọn. ""Ó máa ń jẹ́ ìwúrí fún àwọn akẹ́kọ̀ọ́ yìí pé wọ́n le máa kọ́ èdè wọn , tí wọ́n sì lè máa ṣe àmúlò rẹ̀ ní àwùjọ."" ílé òun. ""Ìsàlẹ̀ Eko ni wọ́n bí mi sí ṣùgbọ́n mo dàgbà sí Amẹ́ríkà. Mo padà wá sí Nàìjíríà nítorí mo fẹ́ kọ́ èdè mi, mo fẹ́ kọ́ àṣà mi,"" Helen Kehinde Thomas sọ fún BBC News Yoruba. Kehinde Emmanuel Oladosu ti wọ́n bí sí ìpínlẹ̀ New York, orílẹ̀ èdè Amẹ́ríkà tí òun náà ń kọ́ nípa èdè Yorùbá náà sọ fún BBC News Yoruba pé bí ó tilẹ̀ jẹ́ pé Ile Ife ní ìpínlẹ̀ Osun àti ìlú Ibadan ní ìpínlẹ̀ Oyo ni àwọn òbí òun ti wá, òun kò ní àǹfàní láti kọ́ nípa èdè Yorùbá ló jẹ́ kí òun padà sílé. ""Ìdí tí mo fi ń kọ́ èdè Yorùbá ni pé mi ò fẹ́ kí àṣà kú lórí mi,"" Kehinde sọ fún BBC. Oluwatumininu Ipaye sọ pé láti kékeré ni òun ti kúrò ní orílẹ̀ èdè Nàìjíríà láti kékeré tí òun sì padà wá kẹ́kọ̀ọ́ nípa èdè Yorùbá nítorí òun kò fẹ́ kí èdè Yorùbá kú n Clement Odoje ṣàlàyé pé èròńgbà ilé ẹ̀kọ́ gíga fásitì ilẹ̀ Ibadan láti dá ilé ẹ̀kọ́ náà sílẹ̀ pọ̀ tí ara rẹ̀ sì jẹ́ láti mú kí àlááfíà jọba ní gbogbo àgbáyé. Ó ní ọdún 2009 ni àwọn ti dá ètò náà sílẹ̀ tí ìjọba Amẹ́ríkà sì báwọn fọwọ́sowọ́pọ̀ láti máa ṣe ìdánilẹ́kọ̀ọ́ fáwọn èèyàn orílẹ̀ èdè rẹ̀. Ní ọdọọdún ni ètò yìí máa ń wáyé tí wọ́n máa ń kó àwọn èèyàn láti Amẹ́ríkà àti orílẹ̀ èdè míì wá sí ilé ẹ̀kọ́ náà láti kọ́ nípa èdè Yorùbá. ""Ètò yìí dàbí ìrìbọmi fáwọn akẹ́kọ̀ọ́ wa tí wọ́n ti kọ́ nípa èdè Yorùbá láti mọ̀ nípa rẹ̀ si.""","One of the roadsow kingdom, will have to be certain that the nations of his universe rejects what his organization has written a foreign land.This is the case with one of the universe in the Nation of the United States to learn from Nigeria to learn to Nigeria, the culture and Nigerian field.Ade Older in the Yoruba University in the University of Ibada School, Clement Humanity says that it is related to the local language and culture from the formation of the program.The young sea like Nigeria, China, Japan, Brazil, Brazil, Spain, and the Spain, and so on to learn about Yoruba language.The Eargography was to learn that the Nigerians were old and unwilling to learn their knowledge of the moral and culture.It includes teaching people in the Yoruba languages ​​to apply in all the teachers who are teaching each other.""It is a source of encouragement to students that they will learn their language and use your use in a group.""his house.""I was born with the education but was young. I turned to Nigeria because I wanted to learn mysterious,"" Helenen Kehin Thomas told BBC the News English.CHINE CHILULUANS ORDOHESUE CHRISTIANS TO THE NEW Yorkuba State BBC The Mornadian territory has not had to learn about the Yoruba language.""The Learning the Yorus is that I do not want havoc on me,"" Khinde told BBC.The Minderuminue asserts that from childhood, he left Nigeria to devote Yoruba language for learning the Yoruba language, and he was not king of the world.For centuries the program was established by the United States helped to cooperate with the people of his universe.The program celebrated by this arrangement through the United States in the United States to learn about Yoruba language.""This program is like this, baptism for our students who have learned about the Yoruba language to find out.""",https://www.bbc.com/yoruba/articles/c05e4djvzlro
finance,Ohun tó yẹ kí o mọ̀ nípa Òṣùpá Ẹlẹ́jẹ̀ tó yọ lójú ọ̀run ní Naijiria lálẹ́ àná àtàwọn orílẹ́èdè míì,Nigerian Fightsome In the sky in Nigeria,"Oríṣun àwòrán, Getty Images Airin jina lai ri abuke ọkẹrẹ, ti eeyan ba rin jina yoo ri ẹja to yarọ ninu ibu. Ni ana ọjọ keje oṣu Kẹsan an ni oṣupa ẹlẹjẹ yọ loju sanmọ lorilẹede Naijiria ati lawọn orilẹede kan lagbaaye. Bo tilẹ jẹ wi pe, awọn onimọ nipa oju ọrun ti sọ ṣaaju wi pe oṣupa ẹlẹjẹ yoo yọ loju sanmọ lalẹ ana, iyalẹnu lo si jẹ fun ọpọ eeyan ti wọn foju gan-an ni rẹ loju ọrun. Awọn onimọ nipa oju ọrun sọ ṣaaju wi pe Naijiria ati Ghana wa lara awọn orilẹede ti oṣupa ẹlẹjẹ naa yoo ti yọ lalẹ ọjọ Aiku lati ilẹ Afirika. Eyi lo si jẹ ki ọpọ eeyan wa ni imurasilẹ ti wọn si n wo oju ọrun lati ri aramanda to fẹ ṣẹlẹ. End of Èyítí A Ń Kà Jùlọ Wọn maa n pe e ni oṣupa ẹlẹjẹ nitori bi inu oṣupa ṣe maa n pọn lasiko ti iṣẹlẹ yii ba waye. Onimọ nipa oju ọrun kan, Ọmọwe Bloomer sọ pe ọpọ eeyan lo maa n ro pe nnkan ti ko dara ni ki oṣupa pọn bi ẹjẹ. Gẹgẹ bi alaye tawọn onimọ nipa oju ọrun sọ, eyi maa n ṣẹlẹ nigba ti aye ba wa laarin oorun ati oṣupa, ti o si n di imọlẹ lati ara oorun si oṣupa. Lasiko ti eyi ba ṣẹlẹ ni ojiji aye maa n bo oṣupa patapata ti oṣupa yoo si di pupa. Nigba miran ẹwẹ, oṣupa maa n yipo aye, eyi si ni ko ni jẹ ki o mọlẹ daadaa lasiko naa. Amọ, nigba ti ara oṣupa ba wọ inu ojiji aye ni awọn eeyan maa n ri pe apa kan da dudu ninu oṣupa. Oṣupa ẹlẹjẹ to jade lalẹ ana ọjọ Aiku foju han lati bii ago mẹrin kọja iṣẹju mejidinlọgbọn. Ni nnkan bi aago mẹwaa alẹ ku isẹju marun un ni o wọ okunkunu pada. Oríṣun àwòrán, Getty Images Àjáàbalẹ̀ ìròyìn BBC News Yorùbá lórí WhatsApp rẹ Darapọ̀ mọ́ wa nibì End of podcast promotion Onimọ kan ni ọpọ eeyan lai moye ọdun sẹyin lo ti kọminu lori oṣupa ẹlẹjẹ bo ya o lewu fawọn eeyan. Ọmọwe Bloomer ni oṣupa ẹlẹjẹ maa n yọ loju ọrun latari itanṣan oorun lati inu ojiji aye to bo oṣupa mọlẹ ni. O ni iru nnkan yii naa lo maa n ṣẹlẹ ti oorun maa n fi n pọn loju ọrun nigba mii. Ọmọwe Bloomer ni nnkan to maa n ṣẹlẹ nigba ti oṣupa ba di pupa lawọn onimọ nipa oju ọrun maa n pe ""Rayleigh scattering"" eyi to maa n jẹ ki oṣupa gbe awọ pupa jade fun igba pipẹ. Onimọ nipa oju ọrun mii, Rachel Dutton, naa ṣalaye idi ti oṣupa ẹlẹjẹ fi maa n yọ loju ọrun. Dutton ni eyi maa n ṣẹlẹ nigba ti ayika aye ba bo oorun mọlẹ ti ko si jẹ ki ina oorun de ara oṣupa. O ni eleyii lo maa n fa a ti ina pupa to rẹwa fi maa n jade ninu oṣupa, ohun si ni awọn eeyan maa n pe ni oṣupa ẹlẹjẹ. Dutton ni ''ti a ba ni aye ti ko ni ayika, oṣupa yoo kan maa yọ loju ọrun, yoo si maa di dudu pada. Amọ, dipo ki iyẹn maa ṣẹlẹ, oṣupa maa n wọ inu ojiji pupa lọ, iyẹn lo maa n fun wa ni oṣupa ẹlẹjẹ.''","Positor Gallery, Getty Images impressed far without seeing abnue abubre, if it walks far from the lame fish.September January sixth the moon was overcome with the moon.Even though the sky by the sky has said before the moon itself will be seamed in the sky, many ignoring the virtual moon.Traders about the sky spoken before Nigeria and Ghana were on the nations of the moonless moon from Africans.This is the most important people in standby they calling the sky to see Aramanda that wants to happen.The end of the moon is usually called because of the moon it often falls out of this event.The Temperator of a sky, Bloom Bloom says that many bad moon often think that is not good.According to the heavenly Information, this usually happens when the world is between the sun and the moon, and becomes light from the sun to the moon.Nowadays if this happens in shadow life usually cover the moon completely of the moon will become red.Sometimes, the moon usually rolls the world, this is not let you down with positively nowadays.Butter, when the moon flashes in the world's shadow is usually found that one arm is black in the moon.The moon gone out tonight night the unknown to like four cups across 36 minutes.At that time the night deceased five in He entered the darkness.Eyes, Getty Images Uzzoplay The Snap Endcast Equity Interface A Small END OF JOLIVERSE SPECIAL SPECIAL SPECIAL SPECIAL SPACE.BloomerMa bloomer at the moon moon often rejoicing the suncloth from the shadow of the world shaped in the shadow.You have been looking for the heavens during my life.""Bloomed Snap, Bloom Shoem was reduced by the Chinese, and the sky by the sky usually calls"" Rayleigh scattering ""so that the moon lifts red for a long time.The Heaven of Heaven, Rachel Dutton, the reason why the moon's moon is often removes in the sky.DUTTON is this usually when the environment surrounds the sun down and no sunlight reaches the moon.It's so useful usually draws to charm charm usually goes out in the moon, things to the people do usually call in mob's moon.DUTTON is '' If we have a world that is not around, the moon will just tear on the sky, it will gradually become black back.Butter, rather than that happens, the moon usually entered the red shadow, that you are gonna give us a moon. ''",https://www.bbc.com/yoruba/articles/ceq2xq5rw70o
finance,"Ẹ̀gbọ́n ṣekúpa àbúrò nítorí ₦20,000 ni Ondo","The Granted dog's dogs for the ₦ 20,000 in your Comment","Oríṣun àwòrán, Getty Images Ọkunrin kan ti orukọ rẹ n jẹ Eze Elechi Amadi ti jẹ wọ pe oun ṣekupa aburo rẹ, ẹni ọdun mejidinlogun, Otu Ifeanyi nijọba ibilẹ Odigbo nipinlẹ Ondo lasiko awọ owo. Amadi, wa lara awọn afurasi mọkindinlọgọrun ti ileeṣẹ ọlọpaa ṣafihan niluu Akure, to jẹ olu ilu nipinlẹ Ondo. Gẹgẹ bii Kọmisana fun ileeṣẹ ọlọpaa nipinlẹ naa, Adebowale Lawal ṣe ṣalaye, imọlẹ tan si iṣẹlẹ naa nigba ti olugbe agbegbe ti iṣẹlẹ ti waye, Oluwafemi Oladipupo kesi ileeṣẹ ọlọpaa leti pe agba alawọ aro kan ti wọn fi okun dudu ṣo wa niwaju ile rẹ. Lẹyin iwadii, ileeṣẹ ọlọpaa ṣawari oku Otu Ifeanyi ninu agba alawọ aro naa to wa niwaju ile Oluwafemi Oladipupo. Dirọmu naa, ni Amadi gbe sori ọkade, to si jabọ lasiko to n gbe lọ pe ki oun lọ ju oku naa sọnu. End of Èyítí A Ń Kà Jùlọ Ọwọ ti tẹ afurasi naa bayii, ti iwadii si ti bẹrẹ lori iṣẹlẹ naa. Agbẹnusọ ileeṣẹ ọlọpaa nipinlẹ Ondo, Alayande Olushola fidi iṣẹlẹ naa mulẹ pe Amadi ṣekupa pe aburo rẹ nitori ẹgbẹrun lọna ogun naira, ₦20,000. Olushola ni afurasi yii lo mu aburo rẹ to di oloogbe wa si ipinlẹ Ondo, to si fẹsun kan pe o ji owo toto ,₦20,000. ""Lẹyin ọpọ ifọrọwanilẹnu, Amadi jẹwọ pe oun sekupa aburo rẹ, Ifeanyi Otu nitori owo to sọ pe o ji. ""Lati le bo ara rẹ ni aṣiri, o gbe oku naa sinu agba nla, to si gbe sori ọkada lati lọ ju danu sibi to jina. ""Ṣugbọn asiri rẹ tu nigba ti agba ọhun yidanu lori ọkada nigba to n lọ, eyi to ṣafihan oku aburo rẹ. ""Kete ni awọn oṣojumikoro kesi ileeṣẹ ọlọpaa, ti afurasi naa si ti wa ni ahamọ bayii."" Agbẹnusọ ọlọpaa ni awọn ti pari iwadii lori iṣẹlẹ naa, ti afurasi ọhun yoo si foju ba ile ẹjọ laipẹ.","Pyosol Gallery, Getty Images a man's name is that he has enwrapsed the angelic countries.Amadi, then on the unchanges of Polish Averea display Niluy, was the capital of the city.According to the Communo Agree, Adbowale Lawa is described, the light spread to the event, the Forces of the police station reminded that a black-waver is prescribed before his house.After investigating Polipian action discovered a gnow of the green barrel before the empire of the Paradise.Amadi, was to the Reperse, and the owner of the Passover, and then he moved to go beyond the dead.The end of that we read the most of the hand we read the Vertras now, which research is starting on the event.Adding Older Toy, the capital of Social Prophet, which is established if it amadi for each one of Naira, ₦ 20,000.This Anapharus has become his uncle with an anger to the endangered, and loses money, of 20,000.""Then Amandi confronts, Amand confirms that he received from his extraordinary proud, and you can cover the dead."" In order to cover the dead.""But your prime release when you go through the ocaca when it is now an anticipator of the Politics."" Politics have been completed at the trip on the scene, which suspect will virtually miss court soon.",https://www.bbc.com/yoruba/articles/c7v13lj65rzo
finance,"Ẹ̀jẹ̀ nínú ìgbọ̀nsẹ̀ àti ìtọ̀, ǹjẹ́ ó léwu bí?",Blood in the Station and Resurrection?,"Oríṣun àwòrán, Getty Images Nnkan yii jẹ ohun to wọpọ lawujọ, to si ma n ba ọpọ lẹru. Ọpọ lo ma n pariwo nigba ti wọn ba ri ẹjẹ ninu itọ wọn, ti wọn yoo si ma ro pe boya wọn ti lugbadi aisan kan tabi wọn ti ni aarun jẹjẹrẹ. Nnkan ti ko ye wọn ni pe, ọpọ idi lo le ṣokunfa eyi, ti wọn si ju ara wọn lọ. Fermin Mearin, ọnimọ eto ilera ni Spain ṣe akọsilẹ awọn ohun to ṣokunfa ki ẹjẹ wa ninu itọ tabi igbọnsẹ fun BBC Mundo. Oríṣun àwòrán, Getty Images Igbona inu: Eyi ma n waye ti ẹjẹ kekere ba n da lati inu, ti wọn si le ri lẹyin ti ohun ti a n pe rectum ba ti ṣi. End of Èyítí A Ń Kà Jùlọ ""Eyi tumọ si pe ẹjẹ n jade lati ibi ti opin rectum yii, to si jẹ pe ibẹ ni iṣoro wa,"" D dokita Mearín ṣalaye. Hemorrhoids: ti o ma n jade ni idi eeyan jẹ ohun ti wọn ko le fi oju lasan ri, ṣugbọn wọn le ri ti wọn ba ṣe ayẹwo. Ti egbo ba wa nibi idi yii, o le fa ki ẹjẹ ma n jade lasiko igbọnsẹ, paapa fun eeyan ti ko ba ki n mu omi daadaa, ti igbọnsẹ naa yoo si le pupọ. Eyi le fa ọpọ inira, ti yoo si ma yọ ẹjẹ. Aisan inu: Eeyan to ba lugbadi aisan 'ulcerative colitis', eyi ma n fa igbona ni ikun ti yoo si maa yọ to ba n ṣe igbọnsẹ. Oríṣun àwòrán, Getty Images Dokita naa sọ siwaju si pe ""Ninu awọn nnkan bayii, lati ṣe afikun si igbona, igbẹ gbooru ati inu didun yoo tun waye."" Wọn yoo ṣe akoba nla fun ikun nla, ti aisan Crohn yoo si kọlu ikun kekere. Eyi ma n mu ayipa ba igbẹ lati dudu si pinpọn. Ti igbẹ ba dudu, to si jade pẹlu ẹjẹ, o le tumọ si pe ọpọ ẹjẹ wa ninu ikun lasiko naa. Ni awọn orilẹede kan, ilana wa ti wọn fi ma se ayẹwo to da lori ọjọ ori eeyan naa. Eyi bẹrẹ pẹlu ṣiṣe awari ẹjẹ ninu igbẹ eeyan lati mọ boya o ni aisan jẹjẹrẹ Colon. Ti ẹjẹ ba wa ninu itọ, wọn yoo fi iru eeyan bẹẹ sori ọpọ ayẹwo, eyi to le jẹ ki ọpọ bẹru. ""Awọn eeyan ma n wa fun ayẹwo pẹlu oye kekere, ṣugbọn pupọ ninu wọn ni lo jẹ pe wọn ko ni iṣoro nla,"" Mearin ṣalaye. Oríṣun àwòrán, Getty Images","Physical galler, Getty images this is common, and it often suits many chiefly.Many people shout when blood is found in their sales, and they will think if they are an illness or they have a disease.They do not understand that, many can improve, and over each other.Fermin Felances, Spain enables our bleeding with bbc and toilet for BBC mundo.PROCESS POLICY, GETTY Images Frank In: ​​This occurs in the inside: This is often used in a small blood fights from, and they can see after what we call the Rectum has opened.The end of the most we read ""This means getting out from where this Recttum's end, is that there is a problem, explained.Hemorrhoids: That's out why a habitity is what they cannot see, but they can see if they examine.If a wound right here, it may cause blood nowadays, especially for a person who does not drink water with, of the toilet will be too much.This may cause many consequences, and will remove blood.Infection: If a person is illuminated 'ulcerative colitis', this results in the stomach and waive to throw it up.ENTRY GOLD, GETTY Images says to that ""in today's things now, to add to warmer, cryerale and satisfaction will be achieved.""They will make great domain for the biggest stomach, which crohn illness will strike a small stomach.This brings a diplomatic from black to looked.If the cruise is black, out with the blood, you can mean that multiple vows in the stomach.In some countries, there is a process that they assess based on the age of the mate.This begins with a bleeding of blood in the drop to know if it's sick manger choron.If the blood is in the saliva, they will put such nets on several samples, which may make many fears.""The nosures are looking for a sample with little amounts, but most of them are used to have a great problem,"" I am explaining.PLAYER Gallery, GETTY Images",https://www.bbc.com/yoruba/articles/cx2p061mv3jo
